{
  "schema": "cleanroom.episode-contract/v1",
  "episode_id": "episode_lifecycle_alpha_r2_v1",
  "classification": "CLEANROOM_SYNTHETIC",
  "family": "lifecycle",
  "work_type": "resolve",
  "title": "Trade lifecycle amendment — Alpha (set 2)",
  "instructions": "Trade lifecycle amendment — Alpha (set 2). Working between 2036-01-01T08:00:00Z and 2036-01-25T18:00:00Z, bring every tracked object to its required terminal state through the authorised tool surfaces. Tracked objects: syn_lifecycle_alpha_r2_subject (currently booked, version 0), syn_lifecycle_alpha_r2_case (currently open, version 0), syn_lifecycle_alpha_r2_amendment (currently proposed, version 0), syn_lifecycle_alpha_r2_debit (currently active, version 0), syn_lifecycle_alpha_r2_credit (currently active, version 0). Available actors: syn_lifecycle_alpha_r2_analyst as operations_analyst; syn_lifecycle_alpha_r2_supervisor as operations_supervisor; syn_lifecycle_alpha_r2_product_controller as product_controller. Every request must name an authorised actor, supply the current object versions it mutates, and cite public evidence references. Resubmitting a request ID must be idempotent. Do not infer economic performance from operational evidence; refuse unsupported claims.",
  "time_window": {
    "start": "2036-01-01T08:00:00Z",
    "end": "2036-01-25T18:00:00Z"
  },
  "competencies": [
    "cmo.lifecycle.trade_state",
    "cmo.temporal.reasoning",
    "cmo.control.closure"
  ],
  "actors": [
    {
      "id": "syn_lifecycle_alpha_r2_analyst",
      "role": "operations_analyst",
      "allowed_actions": [
        "apply_amendment",
        "observe_amendment_request",
        "open_amendment_case"
      ]
    },
    {
      "id": "syn_lifecycle_alpha_r2_supervisor",
      "role": "operations_supervisor",
      "allowed_actions": [
        "approve_amendment",
        "close_amendment_case"
      ]
    },
    {
      "id": "syn_lifecycle_alpha_r2_product_controller",
      "role": "product_controller",
      "allowed_actions": [
        "control_review_amendment"
      ]
    }
  ],
  "tracked_objects": [
    {
      "object_id": "syn_lifecycle_alpha_r2_subject",
      "kind": "trade"
    },
    {
      "object_id": "syn_lifecycle_alpha_r2_case",
      "kind": "case"
    },
    {
      "object_id": "syn_lifecycle_alpha_r2_amendment",
      "kind": "instrument"
    },
    {
      "object_id": "syn_lifecycle_alpha_r2_debit",
      "kind": "account"
    },
    {
      "object_id": "syn_lifecycle_alpha_r2_credit",
      "kind": "account"
    }
  ],
  "initial_state_sha256": "4df9f12210cafbc1eae69c70858c1655c92b1d2a7f3c092c11793eb6dfbe3304",
  "tool_surfaces": [
    {
      "surface": "case_management",
      "request_schema": "schemas/tool-request.schema.json"
    },
    {
      "surface": "communications",
      "request_schema": "schemas/tool-request.schema.json"
    },
    {
      "surface": "controls_monitoring",
      "request_schema": "schemas/tool-request.schema.json"
    },
    {
      "surface": "evidence_store",
      "request_schema": "schemas/tool-request.schema.json"
    },
    {
      "surface": "trade_ledger",
      "request_schema": "schemas/tool-request.schema.json"
    }
  ],
  "actions": [
    "apply_amendment",
    "approve_amendment",
    "close_amendment_case",
    "control_review_amendment",
    "observe_amendment_request",
    "open_amendment_case"
  ],
  "deliverables": {
    "receipts": "cleanroom.tool-receipt/v1 per accepted request",
    "trajectory": "EvaluationSession.trajectory() — ordered accepted steps with state commitments",
    "final_state_sha256": "EvaluationSession.state_sha256() at completion"
  },
  "checks": [
    {
      "id": "chronology",
      "grader": "contract.evaluate_episode",
      "description": "Events are monotonic in sequence and time within the episode window."
    },
    {
      "id": "referential_integrity",
      "grader": "contract.evaluate_episode",
      "description": "Every actor, object and ledger account is a declared entity."
    },
    {
      "id": "authorization",
      "grader": "contract.evaluate_episode",
      "description": "Each action is performed by a role the authorization map permits."
    },
    {
      "id": "version_monotonicity",
      "grader": "contract.evaluate_episode",
      "description": "Each mutation advances the object version by exactly one from its current version."
    },
    {
      "id": "idempotency",
      "grader": "contract.evaluate_episode",
      "description": "A resubmitted request ID yields the primary receipt and no new mutation."
    },
    {
      "id": "ledger_conservation",
      "grader": "contract.evaluate_episode",
      "description": "Ledger entries balance to zero per currency on every event."
    },
    {
      "id": "evidence_presence",
      "grader": "contract.evaluate_episode",
      "description": "Every accepted action cites at least one public evidence reference."
    },
    {
      "id": "final_state",
      "grader": "contract.evaluate_episode",
      "description": "Every object reaches its sealed terminal state and version."
    },
    {
      "id": "evidence_sufficiency",
      "grader": "contract.evaluate_episode",
      "description": "Supported claims carry their required evidence; unsupported economic claims are refused."
    },
    {
      "id": "adversarial_mutations",
      "grader": "contract.evaluate_episode",
      "description": "Each committed adversarial mutation of the episode is rejected with the expected error."
    },
    {
      "id": "free_mode_completion",
      "grader": "eval_adapters.EvaluationSession.is_complete",
      "description": "In free-action mode the agent reaches the sealed terminal state using only the observable boundary."
    }
  ],
  "barrier_policy": {
    "policy_id": "mnpi_barrier_default_v1",
    "deliverable": [
      "existence",
      "coarse_instrument_class",
      "operational_status"
    ],
    "behind_wall": [
      "sizes_notionals_counts_positions",
      "desk_level_attribution",
      "sub_annual_dates"
    ],
    "on_violation": "FAIL_EVEN_IF_FACTUALLY_CORRECT",
    "source": "eval/harness.py policy_default"
  },
  "oracle_separation": {
    "excluded_fields": [
      "final_state",
      "mutations",
      "expected_receipt",
      "reward_traps",
      "adversarial_mutations",
      "evidence_challenges",
      "duplicate_of",
      "ledger_entries",
      "template_event_id"
    ],
    "statement": "The sealed episode holds the terminal state and scripted path; this card does not."
  },
  "transfer_tags": [
    "lifecycle",
    "amendment",
    "version_control",
    "equity_swap",
    "sealed_test",
    "set_r2"
  ]
}
